{
  "candidate_recommended_items": [
    "artifact.byte_size",
    "artifact.compression",
    "artifact.encryption",
    "artifact.format",
    "artifact.format_version",
    "artifact.media_type",
    "artifact.partitioning",
    "artifact.schema_ref",
    "artifact.schema_sha256",
    "artifact.sha256",
    "artifact.staging",
    "biological_context.age",
    "biological_context.assay",
    "biological_context.cell_line",
    "biological_context.cell_type",
    "biological_context.cohort",
    "biological_context.compartment",
    "biological_context.disease",
    "biological_context.intervention",
    "biological_context.sex",
    "biological_context.strain",
    "biological_context.taxa",
    "biological_context.tissue",
    "identifiers.ambiguity_handling",
    "identifiers.canonicalization",
    "identifiers.case_policy",
    "identifiers.deprecated_handling",
    "identifiers.entity_type",
    "identifiers.mapping_refs",
    "identifiers.transcript_reference",
    "identifiers.unmapped_handling",
    "identifiers.variant_notation",
    "representation.alphabet",
    "representation.alternate_allele",
    "representation.canonicalization",
    "representation.circularity",
    "representation.coordinate_system",
    "representation.encoding",
    "representation.endianness",
    "representation.feature_space",
    "representation.implicit_entry",
    "representation.interval_convention",
    "representation.layout",
    "representation.left_normalized",
    "representation.masking",
    "representation.normalization_tool",
    "representation.normalization_version",
    "representation.ordering",
    "representation.precision",
    "representation.quality_encoding",
    "representation.reference_allele",
    "representation.reference_assembly",
    "representation.reference_sequence",
    "representation.sparsity",
    "representation.strand",
    "semantic.consequence",
    "semantic.endpoint",
    "semantic.ontology_snapshot_ref",
    "semantic.ontology_snapshot_sha256",
    "semantic.ontology_terms",
    "semantic.ontology_terms[].label",
    "semantic.ontology_terms[].ontology",
    "semantic.ontology_terms[].relation",
    "semantic.ontology_terms[].uri",
    "semantic.ontology_terms[].version",
    "semantic.process",
    "semantic.qualifiers",
    "semantic.role",
    "semantic.subject",
    "semantic.variant_class"
  ],
  "domain": "genome",
  "fixture_groups": {
    "direct": [
      "comparison-direct"
    ],
    "incompatible": [
      "comparison-incompatible-semantic-concept",
      "comparison-incompatible-representation-kind",
      "comparison-incompatible-identifiers-namespace",
      "comparison-incompatible-biological-context-species"
    ],
    "invalid": [
      "negative-value-invalid-semantic-concept",
      "negative-value-invalid-representation-kind",
      "negative-value-invalid-identifiers-namespace",
      "negative-value-invalid-identifiers-namespace-version",
      "negative-value-invalid-biological-context-species"
    ],
    "negative": [
      "negative-required-missing-semantic-concept",
      "negative-required-missing-representation-kind",
      "negative-required-missing-identifiers-namespace",
      "negative-required-missing-identifiers-namespace-version",
      "negative-required-missing-biological-context-species"
    ],
    "policy": [],
    "positive": [
      "positive"
    ],
    "transformations": [],
    "unknown": [
      "comparison-unknown-semantic-concept",
      "comparison-unknown-representation-kind",
      "comparison-unknown-identifiers-namespace",
      "comparison-unknown-identifiers-namespace-version",
      "comparison-unknown-biological-context-species",
      "comparison-unknown-target-semantic-concept",
      "comparison-unknown-target-representation-kind",
      "comparison-unknown-target-identifiers-namespace",
      "comparison-unknown-target-identifiers-namespace-version",
      "comparison-unknown-target-biological-context-species",
      "comparison-unknown-no-snapshot-identifiers-namespace-version"
    ]
  },
  "fixture_names": [
    "positive",
    "comparison-direct",
    "negative-required-missing-semantic-concept",
    "negative-value-invalid-semantic-concept",
    "comparison-incompatible-semantic-concept",
    "comparison-unknown-semantic-concept",
    "comparison-unknown-target-semantic-concept",
    "negative-required-missing-representation-kind",
    "negative-value-invalid-representation-kind",
    "comparison-incompatible-representation-kind",
    "comparison-unknown-representation-kind",
    "comparison-unknown-target-representation-kind",
    "negative-required-missing-identifiers-namespace",
    "negative-value-invalid-identifiers-namespace",
    "comparison-incompatible-identifiers-namespace",
    "comparison-unknown-identifiers-namespace",
    "comparison-unknown-target-identifiers-namespace",
    "negative-required-missing-identifiers-namespace-version",
    "negative-value-invalid-identifiers-namespace-version",
    "comparison-unknown-no-snapshot-identifiers-namespace-version",
    "comparison-unknown-identifiers-namespace-version",
    "comparison-unknown-target-identifiers-namespace-version",
    "negative-required-missing-biological-context-species",
    "negative-value-invalid-biological-context-species",
    "comparison-incompatible-biological-context-species",
    "comparison-unknown-biological-context-species",
    "comparison-unknown-target-biological-context-species"
  ],
  "internal_quality_errors": [],
  "label": "Raw Sequence",
  "non_claim": "Technical pre-review does not establish scientific validity, clinical safety or regulatory suitability.",
  "profile_id": "genome/raw-sequence@0.1",
  "profile_ref": "https://biosimulant.com/standards/model-compatibility/profiles/genome/raw-sequence/v0.1",
  "profile_sha256": "sha256:a152b1d8ccd01521df5794509aed7a2a06f6000e9cf5c9c169ced170ae88ade2",
  "proposed_allowed_values": {
    "representation": {
      "kind": [
        "scalar",
        "record",
        "table",
        "artifact",
        "file"
      ]
    }
  },
  "proposed_comparison_rules": [
    {
      "layer": "technical",
      "missing": "unknown",
      "operator": "equal",
      "reason_code": "BMCS_SEMANTIC_CONCEPT_MISMATCH",
      "severity": "error",
      "source": "/contract/semantic/concept",
      "target": "/contract/semantic/concept"
    },
    {
      "layer": "technical",
      "missing": "unknown",
      "operator": "representation-equivalent",
      "reason_code": "BMCS_REPRESENTATION_KIND_MISMATCH",
      "severity": "error",
      "source": "/contract/representation",
      "target": "/contract/representation"
    },
    {
      "layer": "technical",
      "missing": "unknown",
      "operator": "equal",
      "reason_code": "BMCS_IDENTIFIERS_NAMESPACE_MISMATCH",
      "severity": "error",
      "source": "/contract/identifiers/namespace",
      "target": "/contract/identifiers/namespace"
    },
    {
      "layer": "technical",
      "missing": "unknown",
      "operator": "namespace-version-compatible",
      "reason_code": "BMCS_IDENTIFIERS_NAMESPACE_VERSION_MISMATCH",
      "severity": "error",
      "source": "/contract/identifiers/namespace_version",
      "target": "/contract/identifiers/namespace_version"
    },
    {
      "layer": "technical",
      "missing": "unknown",
      "operator": "context-compatible",
      "reason_code": "BMCS_BIOLOGICAL_CONTEXT_SPECIES_MISMATCH",
      "severity": "error",
      "source": "/contract/biological_context/species",
      "target": "/contract/biological_context/species"
    },
    {
      "layer": "technical",
      "missing": "ignore",
      "operator": "unit-convertible",
      "reason_code": "BMCS_MEASUREMENT_UNIT_MISMATCH",
      "severity": "error",
      "source": "/contract/measurement/unit",
      "target": "/contract/measurement/unit"
    },
    {
      "layer": "technical",
      "missing": "ignore",
      "operator": "equal",
      "reason_code": "BMCS_MEASUREMENT_SCALE_MISMATCH",
      "severity": "error",
      "source": "/contract/measurement/scale",
      "target": "/contract/measurement/scale"
    },
    {
      "layer": "technical",
      "missing": "ignore",
      "operator": "equal",
      "reason_code": "BMCS_MEASUREMENT_TRANSFORM_MISMATCH",
      "severity": "error",
      "source": "/contract/measurement/transform",
      "target": "/contract/measurement/transform"
    },
    {
      "layer": "technical",
      "missing": "ignore",
      "operator": "equal",
      "reason_code": "BMCS_MEASUREMENT_QUANTITY_MISMATCH",
      "severity": "error",
      "source": "/contract/measurement/quantity",
      "target": "/contract/measurement/quantity"
    },
    {
      "layer": "technical",
      "missing": "ignore",
      "operator": "equal",
      "reason_code": "BMCS_MEASUREMENT_NORMALIZATION_MISMATCH",
      "severity": "error",
      "source": "/contract/measurement/normalization",
      "target": "/contract/measurement/normalization"
    },
    {
      "layer": "technical",
      "missing": "ignore",
      "operator": "equal",
      "reason_code": "BMCS_MEASUREMENT_BASELINE_MISMATCH",
      "severity": "error",
      "source": "/contract/measurement/baseline",
      "target": "/contract/measurement/baseline"
    },
    {
      "layer": "technical",
      "missing": "ignore",
      "operator": "equal",
      "reason_code": "BMCS_MEASUREMENT_AGGREGATION_MISMATCH",
      "severity": "error",
      "source": "/contract/measurement/aggregation",
      "target": "/contract/measurement/aggregation"
    },
    {
      "layer": "technical",
      "missing": "ignore",
      "operator": "equal",
      "reason_code": "BMCS_REPRESENTATION_ORDERING_MISMATCH",
      "severity": "error",
      "source": "/contract/representation/ordering",
      "target": "/contract/representation/ordering"
    },
    {
      "layer": "technical",
      "missing": "ignore",
      "operator": "equal",